ID,Movie_name,Overview,Genres,Release Date,Collection_name,backdrop_path,poster_path
10421,La Guerre des boutons,"For generations, two rival French villages, Longueverne and Velrans, have been at war. But this is no ordinary conflict, for the on-going hostilities are between two armies of young schoolboys. When he is beaten by his father for having lost his buttons, the leader of the Longueverne army, Lebrac, has an idea which will give his side the advantage: next time, he and his brave soldiers will go in battle without their clothes...",Comedy,4/18/1962,,/wdaZJEEEw245HjdDJh938FfWfEo.jpg,/3mD4rlFtYlF26ZxOp0LdlRq47aS.jpg
10422,Abgeschminkt!,"An original satire about women of the 90s in search of the men of their dreams. Franzy believes she's through with men, but desperately needs new amorous story lines for the comic strip she writes for a newspaper. So she observes her friend Maischa struggling to satisfy her need for love -- and someone who knows how to install her new shelf. Since joiner Klaus demands too much attention, she sets her eyes on the good-looking footballer Rene.",Comedy,2/18/1993,,/mVNdiCsAut1rPo4fsRp7OoSBfPF.jpg,/uz6TpyNtVog06UvAeXrW9vLFtqC.jpg
10423,Dragon: The Bruce Lee Story,"This film is a glimpse into the life, love and the unconquerable spirit of the legendary Bruce Lee. From a childhod of rigorous martial arts training, Lee realizes his dream of opening his own kung-fu school in America. Before long, he is discovered by a Hollywood producer and begins a meteroric rise to fame and an all too short reign as one the most charasmatic action heroes in cinema history.",Drama,5/7/1993,,/vem6btyGB15qA3FdU8stPJV3UiD.jpg,/lxhsdC8wuGgQf0gKCt8wyHHxGcQ.jpg
10424,Jennifer Eight,"A big city cop from LA moves to a small town police force and immediately finds himself investigating a murder. Using theories rejected by his colleagues, the cop, John Berlin, meets a young blind woman named Helena, who he is attracted to. Meanwhile, a serial killer is on the loose and only John knows it.",Crime,11/6/1992,,/fqad5Kvxiv7RqaXcyqfbRaEI1xK.jpg,/pMlk8spEliRD6hr4ILs5ubHeBGT.jpg
10425,The Death and Life of Bobby Z,"A DEA agent provides former Marine Tim Kearney with a way out of his prison sentence: impersonate Bobby Z, a recently deceased drug dealer, in a hostage switch with a crime lord. When the negotiations go awry, Kearney flees, with Z's son in tow.",Drama,7/23/2007,,/qxLzU7VVcwwjvqTZKAn176jMojf.jpg,/sgIthxRLUBTbaetVXvXwQEmbfn2.jpg
10426,Friday After Next,"Craig and his cousin Day Day have finally moved out of their parents' houses and into their own crib, working nights at a local mall as security guards. When their house is robbed on Christmas Eve they set out to track down the culprit.",Comedy,11/22/2002,Friday Collection,/tPltOE6HiKoIrbgXYIr7mrUaCEN.jpg,/sxHFGPKLWj9e3aaA6wGVxghoiPE.jpg
10427,Red Rock West,"When a promised job for Texan Michael fails to materialise in Wyoming, Mike is mistaken by Wayne to be the hitman he hired to kill his unfaithful wife, Suzanne. Mike takes full advantage of the situation, collects the money and runs. During his getaway, things go wrong, and soon get worse when he runs into the real hitman, Lyle.",Thriller,5/14/1993,,/3JbHPpUJ53I52w66jydAhIp8Ibe.jpg,/ewofUEqU3Gpr7WSgSz3TEVPIfBg.jpg
10428,Hackers,"Along with his new friends, a teenager who was arrested by the US Secret Service and banned from using a computer for writing a computer virus discovers a plot by a nefarious hacker, but they must use their computer skills to find the evidence while being pursued by the Secret Service and the evil computer genius behind the virus.",Action,9/14/1995,,/5UW7k7V7vP1ytrYNux4oT6L0Jdc.jpg,/qfx2EENW1sOpKNVKLzr7VOhlxkt.jpg
10429,Takedown,"Kevin Mitnick is quite possibly the best hacker in the world. Hunting for more and more information, seeking more and more cyber-trophies every day, he constantly looks for bigger challenges. When he breaks into the computer of a security expert and an ex-hacker, he finds one - and much more than that...",Thriller,3/15/2000,,/paKUtzGu68tcHs322DWvGpE4hCk.jpg,/vQk9GLOjM7gAfqHdWWzt7emGP16.jpg
10431,War,"FBI agent Jack Crawford is out for revenge when his partner is killed and all clues point to the mysterious assassin Rogue. But when Rogue turns up years later to take care of some unfinished business, he triggers a violent clash of rival gangs. Will the truth come out before it's too late? And when the dust settles, who will remain standing?",Action,8/24/2007,,/bCSi411doWOgFz1o8OzEwXfU1jf.jpg,/pBwU58L6qR4dwbFSJSWXIeDGePp.jpg
10432,Hack!,"Seven college students are picked to travel to a private island owned by the reclusive Vincent King and his film-obsessed wife Mary Shelley to study island wildlife. But is isn't long when a mysterious killer begins killing the students one-by-one, and modeling them after gory murder scenes from numerous horror films.",Comedy,7/20/2007,,,/5hzu3koIOvGIA28c1nxPPuEZSnN.jpg
10433,Mad Dog and Glory,"Wayne Dobie is a shy cop whose low-key demeanor has earned him the affectionate nickname ""Mad Dog."" After Mad Dog saves the life of Frank Milo, a crime boss and aspiring stand-up comedian, he's offered the company of an attractive young waitress named Glory for a week. At first both are uneasy about the arrangement, but they eventually fall in love. However, the situation becomes complicated when Milo demands Glory back.",Comedy,3/5/1993,,/5GB8iFXYYsZA9cMWRTmD0RXif9S.jpg,/wmgmTe9uQ5mtudN6e4IVEGvSqg1.jpg
10434,"In weiter Ferne, so nah!","Damiel is now married to Marion, runs the pizzeria “Da Angelo” and the two have a child. The solitarily remaining angel Cassiel is more and more dissatisfied with his destiny as a mere observer of human life and finally decides to take the great leap. As Karl Engel he soon gets into a dubious milieu and finds himself as the assistant of the German American Baker, who makes his money with shady arms deals and sends porno films east in exchange for weapons. Cassiel’s adventure turns into a “thriller” when he decides to put a stop to Baker’s game.",Drama,9/1/1993,Damiel and Cassiel,/vH9tWlWgIqHcHtW8JC0SJoyVSlS.jpg,/5VaPw0NgM4DloukmQTggzgvD4rb.jpg
10435,Chaplin,"An elderly Charlie Chaplin discusses his autobiography with his editor, recounting his amazing journey from his poverty-stricken childhood to world-wide success after the ingenious invention of the Little Tramp.",Drama,12/17/1992,,/hM6KkEajkdQ1dBvEjhQcxPriIai.jpg,/cuCkhiuhPhb0wo05pgO209l3sk9.jpg
10436,The Age of Innocence,"Tale of 19th century New York high society in which a young lawyer falls in love with a woman separated from her husband, while he is engaged to the woman's cousin.",Drama,9/10/1993,,/Auf7Fbf2BW2h32vrNwgEb7uJJhi.jpg,/4AZTFjb3NaRpVXQA4irlQvhfar.jpg
10437,The Muppet Christmas Carol,"A retelling of the classic Dickens tale of Ebenezer Scrooge, miser extraordinaire. He is held accountable for his dastardly ways during night-time visitations by the Ghosts of Christmas Past, Present, and future.",Music,12/10/1992,,/68KpdTMdBTEemcvPZ09J8C32WpG.jpg,/ssrV29QSVVJuemBHho0Qx7pFYak.jpg
10438,Beethoven's 2nd,"Beethoven is back -- and this time, he has a whole brood with him now that he's met his canine match, Missy, and fathered a family. The only problem is that Missy's owner, Regina, wants to sell the puppies and tear the clan apart. It's up to Beethoven and the Newton kids to save the day and keep everyone together.",Family,12/14/1993,Beethoven Collection,/scflR8R2VHXZ7ypHbUPcey0dw2u.jpg,/biH5hW1BRfEr13oCizuAzpdBf2l.jpg
10439,Hocus Pocus,"After 300 years of slumber, three sister witches are accidentally resurrected in Salem on Halloween night, and it is up to three kids and their newfound feline friend to put an end to the witches' reign of terror once and for all.",Comedy,7/16/1993,The Hocus Pocus Collection,/ncr6KR7bBF8cps6yZKiTAwClpn1.jpg,/emyI24MDEB29nL5OwOthAnKIrqU.jpg
10440,Manhattan Murder Mystery,A middle-aged couple suspects foul play when their neighbor's wife suddenly drops dead.,Comedy,5/2/1993,,/28JIQEPTBN5pSXbTAeASX9mrZCF.jpg,/zrzBIlMyAP7Ac9W5qAy5ssAUdK4.jpg
10442,So I Married an Axe Murderer,"Just after a bad breakup, Charlie MacKenzie falls for lovely butcher Harriet Michaels and introduces her to his parents. But, as voracious consumers of sensational tabloids, his parents soon come to suspect that Harriet is actually a notorious serial killer -- ""Mrs. X"" -- wanted in connection with a string of bizarre honeymoon killings. Thinking his parents foolish, Charlie proposes to Harriet. But while on his honeymoon with her, he begins to fear they were right.",Comedy,7/30/1993,,/2ktZP1BTa3VtSXPfp3JhxPnunfh.jpg,/wMr6ZjfOnCHOA9Qm3jvo0e7nzfx.jpg
10443,Fearless,"After a terrible air disaster, survivor Max Klein emerges a changed person. Unable to connect to his former life or to wife Laura, he feels godlike and invulnerable. When psychologist Bill Perlman is unable to help Max, he has Max meet another survivor, Carla Rodrigo, who is wracked with grief and guilt since her baby died in the crash which she and Max survived.",Drama,10/15/1993,,/bTlaFX8RjtAueDoCQXCoSPTM0IL.jpg,/yiCAa85nJJDFiq0LmZ2Fgvu4RgY.jpg
10444,Das Testament des Dr. Mabuse,No overview found.,Horror,9/6/1962,Dr. Mabuse Collection,/jmd4gNsie7eXEcnS0daSlxRZEBm.jpg,/71qvXZJ6a3Yhil8gT4l7GZmZ9sQ.jpg
10445,Shadowlands,"C.S. Lewis, a world-renowned writer and professor, leads a passionless life until he meets spirited poet Joy Gresham",Drama,12/25/1993,,/n8YlQv95wdN12nEtswfFzOk2psK.jpg,/5jTWY1M2O4Zhid4rLOpftzazRGn.jpg
10446,The High Crusade,"Medieval crusaders from the 13th century are captured by aliens. However, this can not stop them to conquer the Holy Land.",Adventure,6/2/1994,,/dzCQCpQ2jbFYLcl5BI7Ybmy7Wd7.jpg,/pip0eSaVIfHY333bjnQmAYcKbCm.jpg
10447,No Escape,"In the year 2022, a ruthless prison warden has created the ultimate solution for his most troublesome and violent inmates: Absolom, a secret jungle island where prisoners are abandoned and left to die. But Marine Captain John Robbins, convicted of murdering a commanding officer, is determined to escape the island in order to reveal the truth behind his murderous actions and clear his name.",Action,4/29/1994,,/tgp4OH8lBhXMnj23h2jM8A99DHr.jpg,/jBVyUBqaMf66WJ7bsJrzmCz8QmW.jpg
10448,Rapa Nui,Inter-tribal rivalry leads to a competition to erect a huge statue (moai) in record time before Make can take part in the race to retrieve the egg of a Sooty Tern. The reward for winning this race is to rule the island for one year.,Adventure,9/9/1994,,/t1karmKKqG6OlLIYtHvD4AfxFCB.jpg,/h6XgXDTBhoDtkgSGbNLDYyQ48ya.jpg
10449,When a Man Loves a Woman,"An airline pilot and his wife are forced to face the consequences of her alcoholism when her addictions threaten her life and their daughter's safety. While the woman enters detox, her husband must face the truth of his enabling behavior.",Drama,4/29/1994,,/k8jPMeggYbAlso3i38f6vVbT4zZ.jpg,/cA1uMNX3sdWAWfMZbsgm1VIJYSY.jpg
10450,Il silenzio dei prosciutti,"The federal agent Joe Dee Foster is currently investigating a serial killer, helped by doctor Animal who is isolated in a maximum security jail.",Thriller,3/11/1994,,/dmkJIceANxjGVI0qHOsXYtxiuoE.jpg,/s4mxntM3FM7joVGz1LECSGfvYtm.jpg
10451,飲食男女,"The film tells the story of a retired and widowed Chinese master chef Chu (Si Hung Lung) and his family living in modern day Taipei, Taiwan. At the start of the film, he lives with his three attractive daughters, all of whom are unattached. As the film progresses, each of the daughters encounters new men in their lives. When these new relationships blossom, the stereotypes are broken and the living situation within the family changes.. The film features several scenes displaying the techniques and artistry of gourmet Chinese cooking. Since the family members have difficulty expressing their love for each other, the intricate preparation of banquet quality dishes for their Sunday dinners is the surrogate for their familial feelings.",Comedy,1/28/1994,,/4t5ImGrZLNUwOiKfLLi4iE9A2EV.jpg,/ktdCBg2Xq2Ry0fuJYT4izktM2Hg.jpg
10452,La Reine Margot,"The night of August 24, 1572, is known as the Massacre of St. Bartholomew. In France a religious war is raging. In order to impose peace a forced wedding is arranged between Margot de Valois, sister of the immature Catholic King Charles IX, and the Hugenot King Henri of Navarre. Catherine of Medici maintains her behind-the-scenes power by ordering assaults, poisonings, and instigations to incest.",Drama,5/11/1994,,/xJGk8yDUQMcEjqyfcXEqzFa3ncP.jpg,/pP2eqqg28Ccfr9XLuegq3UjOWAR.jpg
10458,Lautlos,No overview found.,Action,4/22/2004,,/7pUkOgPn6tXNbtT49iumCRurSfr.jpg,/hU7JZLPG1Pgkk1fsEsRFXCbdZ9g.jpg
10461,Get Carter,"Remake of the British classic. Jack Carter, a mob enforcer living in Las Vegas, travels back to his hometown of Seattle for his brother's funeral. During this visit, Carter realizes that the death of his brother was not accidental, but a murder. With this knowledge, Carter sets out to kill all those responsible.",Action,10/6/2000,,/ujWmNWegwiMqLbdKibmYYTvfuED.jpg,/7VpfpxZCewEHTrUYwMb9pb9ggSz.jpg
10462,Don't Drink the Water,"Somewhere behind the early 1960s cold-war iron curtain, the Hollander family cause an international spying incident when Walter photographs a sunset in a sensitive region. In order to stay out of jail, the Hollanders take refuge in the American Embassy, which is temporarily being run by the absent Ambassador's diplomatically incompetent son, Axel.",Comedy,12/18/1994,,/dyKG1m4uCTtpwt2GO9NBtMUAWTs.jpg,/4cDc7qfoc8IsUPdkD3yUSufFbDl.jpg
10463,Ostkreuz,"OSTKREUZ tells the episodic story of 15-year-old Elfie, who literally and metaphorically inhabits a no-man’s-land between the two Germanies shortly after the fall of the Berlin Walll. The film deploys a neorealist aesthetic to reinforce the difficulties confronting the girl, and by inference, Germany.",Drama,7/23/1991,,,/hmoYl2y24byL1nDo8Jmrzj1eil0.jpg
10464,"Corrina, Corrina","When Manny Singer's wife dies, his young daughter Molly becomes mute and withdrawn. To help cope with looking after Molly, he hires sassy housekeeper Corrina Washington, who coaxes Molly out of her shell and shows father and daughter a whole new way of life. Manny and Corrina's friendship delights Molly and enrages the other townspeople.",Comedy,8/12/1994,,/kNZWblzIEtfGkFIM91hMH18D203.jpg,/t0wI2CuqP745ZFOTufIDdPoz2fa.jpg
10466,The Money Pit,"After being evicted from their Manhattan apartment, a couple buy what looks like the home of their dreams—only to find themselves saddled with a bank-account-draining nightmare. Struggling to keep their relationship together as their rambling mansion falls to pieces around them, the two watch in hilarious horror as everything—including the kitchen sink—disappears into the Money Pit.",Comedy,3/26/1986,,/lAPeFumkT13Faugh5K0jf7vSWIO.jpg,/bohhidIi1WWU5NNYF9l5wLQu3Ii.jpg
10467,The Road to Wellville,"An unhappy young couple visit the infamous Kellogg spa in Battle Creek, Michigan while a young hustler tries get into the breakfast-cereal business and compete against John Kellogg's corn flakes.",Comedy,10/28/1994,,/tT7a8rg1vP1AsblDaV2EAsf8L3Q.jpg,/zh7OVdFMpqpZ027z9RgVIwzxYjZ.jpg
10468,28 Days,"After getting into a car accident while drunk on the day of her sister's wedding, Gwen Cummings is given a choice between prison or a rehab center. She chooses rehab, but is extremely resistant to taking part in any of the treatment programs they have to offer, refusing to admit that she has an alcohol addiction.",Comedy,4/6/2000,,/y6jnlfbowV6hc1cmZvwXX9cOzyr.jpg,/8SOJsSg7cOLyqADsZxP3ZVKo03S.jpg
10469,"Komm, süßer Tod","Former detective Brenner has become an ambulance driver and finds himself, much to his dismay, caught up in a war between two rival first aid organizations.",Comedy,12/22/2000,Simon Brenner Collection,/nlsJA45YJxXbMi9hwmdDQHVff8n.jpg,/l3ujuVALD9q6IYTYRAwpPxYyIMj.jpg
10470,Werner - Gekotzt wird später!,"Werner, Andi and Eckat play dice to determine the next king of the trio. When Werner is crowned king, he decides for all of them to skip work and start for Korsika.",Animation,7/17/2003,Werner Collection,/w1bljLz20AYhLYP0vEqBI5XkyAF.jpg,/rxB5bUg6XrDFTffj6l8XeFh2i1V.jpg
10471,Next Friday,"A streetwise man flees South Central Los Angeles, heading to the suburbs and his lottery-winner uncle and cousin, to avoid a neighborhood thug with a grudge who has just escaped from prison.",Comedy,1/12/2000,Friday Collection,/aEo3hKjdfJ5wmPz12TNexMoK6vW.jpg,/dP4fYCGQZzg17ta7FvLwJVCwwt9.jpg
10472,Down to You,"College coeds in New York City, Al, the son of a celebrity chef, and Imogen, a talented artist, become smitten the second they lay eyes on one another at a bar. However, the road to happiness is not a smooth one. Outside forces, including a predatory porn star who wants to lure Al into her bed, threaten to pull apart the young lovers before their romance has a chance to really flourish.",Comedy,1/21/2000,,/sZNcccoYYRy8js005ViKIsa4Z03.jpg,/ptvHDZtJxj9kj1unae6ryoXsmud.jpg
10473,DragonHeart: A New Beginning,"When Geoff, an orphaned stable boy (Chris Masterson), discovers Drake (voice of Robby Benson), the world's last living dragon, he realizes that his dream of becoming a knight in shining armor can now come true. Together, they soon face challenges that turn them into heroes. But caught up in the excitement of their new lives, Geoff and Drake fail to see the hidden dangers that surround them.",Action,8/8/2000,DragonHeart Collection,/oASfjqueQdR0wpeI2Q4xW2mSaZ.jpg,/yTRf0eiLAFCSRfiboiUFUloRc3l.jpg
10474,The Basketball Diaries,A high school basketball player’s life turns upside down after free-falling into the harrowing world of drug addiction.,Drama,4/21/1995,,/nb8pMW3o85jATvhz7y6clAFlL1u.jpg,/9qX10tQz0hvppk30CDrz73fZTPQ.jpg
10475,Factotum,"This drama centers on Hank Chinaski, the fictional alter-ego of ""Factotum"" author Charles Bukowski, who wanders around Los Angeles, CA trying to live off jobs which don't interfere with his primary interest, which is writing. Along the way, he fends off the distractions offered by women, drinking and gambling.",Comedy,4/25/2005,,/k41nJTWy18zAWv0mGqXOfLCb7Ct.jpg,/qfuqZHaAFiC4N8natPXojrpXR2y.jpg
10476,Hustle & Flow,"With help from his friends, a Memphis pimp in a mid-life crisis attempts to become a successful hip-hop emcee.",Drama,7/22/2005,,/7B05PWjXIW7uiO3x5ZpmuTQJsIO.jpg,/irsY25rutwClUZK2SP0sEQLGfHT.jpg
10477,Driven,"Talented rookie race-car driver Jimmy Bly has started losing his focus and begins to slip in the race rankings. It's no wonder, with the immense pressure being shoveled on him by his overly ambitious promoter brother as well as Bly's romance with his arch rival's girlfriend Sophia. With much riding on Bly, car owner Carl Henry brings former racing star Joe Tanto on board to help Bly. To drive Bly back to the top of the rankings, Tanto must first deal with the emotional scars left over from a tragic racing accident which nearly took his life.",Action,4/27/2001,,/w4Jvkb6BQGvQ3K3aECMsy6bZln3.jpg,/2aN2BBAbRyfEpfxZAQY82T8zWRq.jpg
10478,Tin Cup,A washed up golf pro working at a driving range tries to qualify for the US Open in order to win the heart of his succesful rival's girlfriend.,Comedy,8/16/1996,,/xVKFyLJXPanmd3IZYynq6MNkzHz.jpg,/rB7OvMmjcBFoogleORaUqrRgp8g.jpg
10479,Rules of Engagement,"Part war movie, part courtroom thriller, this gripping drama finds a war hero put on trial for a rescue mission gone terribly wrong with only his doubtful friend and fellow marine to represent him.",Action,4/7/2000,,/3FkPmN3YXEi68zcNjiibOQ9fgNT.jpg,/8qU4Df4PXZUO8rYgEXlFkb5BBSs.jpg
10480,Nurse Betty,"What happens when a person decides that life is merely a state of mind? If you're Betty, a small-town waitress and soap opera fan from Fair Oaks, Kansas, you refuse to believe that you can't be with the love of your life just because he doesn't really exist. After all, life is no excuse for not living. Traumatized by a savage event, Betty enters into a fugue state that allows -- even encourages -- her to keep functioning... in a kind of alternate reality.",Comedy,8/30/2000,,/gMWwbkVNb9nnyH9KcD2KkM1JlwD.jpg,/1OCHR9z9k7go669AsShOkTj4CFb.jpg
10481,102 Dalmatians,"Get ready for a howling good time as an all new assortment of irresistible animal heroes are unleashed in this great family tail! In an unlikely alliance, the outrageous Waddlesworth - a parrot who thinks he's a Rottweiler - teams up with Oddball - an un-marked Dalmatian puppy eager to earn her spots! Together they embark on a laugh-packed quest to outwit the ever-scheming Cruella De Vil.",Comedy,10/7/2000,101 Dalmatians (Live-Action) Collection,/eqZ5t82asfprFcNS56eVruNT5G5.jpg,/dSxnIika9yWwTvEbpsmoGdeh65E.jpg
10482,Guest House Paradiso,"Richie and Eddie are in charge of the worst hotel in the UK, Guest House Paradiso, neighbouring a nuclear power plant. The illegal immigrant chef has fled and all the guests have gone. But when a famous Italian filmstar, Gina Carbonara, who is in hiding from a fiance she doesn't want to marry, arrives at the hotel, things get very interesting!",Comedy,12/3/1999,,/dYso244yCYb6VkNjqUedAzJsgA7.jpg,/8kHQZ0O28QD6GPLDcDzM1WMgRBg.jpg
10483,Death Race,"Terminal Island, New York: 2020. Overcrowding in the US penal system has reached a breaking point. Prisons have been turned over to a monolithic Weyland Corporation, which sees jails full of thugs as an opportunity for televised sport. Adrenalized inmates, a global audience hungry for violence and a spectacular, enclosed arena come together to form the 'Death Race', the biggest, most brutal event.",Action,8/22/2008,Death Race Collection,/buqaSUVoFaTZGJzVD0w1a14RMMD.jpg,/5A79GeOb3uChQ0l0ZDjDyODKQp3.jpg
10484,Les compères,"Unable to find her runaway son, a woman deceives two of her ex-lovers from her youth, a mild-mannered teacher and a tough journalist, that each is the real father in order to obtain their help.",Comedy,11/23/1983,,/wzTQzAAJUu0Is0RyHrRIjjhjL4F.jpg,/vtF5VPPRc8LLPeyPWj7xI8B4jLb.jpg
10485,Ghost Dad,"A widower with three children is working on a business deal to get his family out of financial straits when he is killed in a taxi accident. With the aid of a paranormal researcher, he attempts to complete the deal from the beyond, ensuring his family will be taken care of.",Comedy,6/29/1990,,/7jj4D39erl0hul2pQYlP7o0NwtX.jpg,/vYNIUUkJSZixxrfpMLFgVlagbaf.jpg
10486,My Father the Hero,"A teenage girl on vacation in the Bahamas with her divorced father tries to impress a potential boyfriend by saying that her father is actually her lover. Remake of the 1991 French film Mon père, ce héros.",Comedy,2/4/1994,,/i3gc7ucWJA8l1BffwqkvUIPHv6x.jpg,/qOP80oUZRTT7EsV7EZA9aBa95dQ.jpg
10487,"Zur Sache, Schätzchen","Martin is 25 years old and very reserved about work. Together with his buddy Henry, he lives in their Schwabing apartment in the day. But everything changes when he falls in love with the attractive Barbara and observed a slump: For when he gives up the police report, the officials themselves suspect him of the crime. In addition, he still owes a text to the hit producer Viktor Block. Suddenly Martin is up to his ears in chaos.",Comedy,1/4/1968,,/19XGHZTtfkeby96tJEvsZDzgAdd.jpg,/yMOFVSeDVM8MdKb6xL7l0iY0pEH.jpg
10488,Nim's Island,A young girl inhabits an isolated island with her scientist father and communicates with a reclusive author of the novel she's reading.,Adventure,4/3/2008,Nim's Island Collection,/yXqNFTsp2P3fSkSQvs0vxkQF586.jpg,/vhNoXDpc7T5OdmAuu8DMHLB39uo.jpg
10489,Cujo,"A friendly St. Bernard named ""Cujo"" contracts rabies and conducts a reign of terror on a small American town.",Horror,8/10/1983,,/5AjXG1IHWfaODtzmWOkQGbmF3nZ.jpg,/uNBt2YxrQdyOjnm2rDQ5QiCmQ0K.jpg
10490,Drop Dead Gorgeous,"In a small Minnesota town, the annual beauty pageant is being covered by a TV crew. Former winner Gladys Leeman wants to make sure her daughter follows in her footsteps; explosions, falling lights, and trailer fires prove that. As the Leemans are the richest family in town, the police are pretty relaxed about it all. Despite everything, main rival (but sweet) Amber Atkins won't give up without a fight.",Comedy,7/23/1999,,/50P0Bl2AxRTrG5GTdkMcfs6INKC.jpg,/iMMvFvHhURa4cWv6CxhpwIDjme2.jpg
10491,Enigma,"The story of the WWII project to crack the code behind the Enigma machine, used by the Germans to encrypt messages sent to their submarines.",Mystery,1/22/2001,,/ypOBosXYg2jjCHyZBpX21if0qOv.jpg,/7gBFkDYBqvSzrPOWlpGTXRp97NQ.jpg
10492,Flashback - Mörderische Ferien,"A young woman is released from an asylum where she has been since witnessing the murder of her parents, but violence continues to haunt her.",Horror,4/6/2000,,/ttgFQOIaTUBJReFO0l8A8BcFcKV.jpg,/vKy37Ia72IxReRk2KVGICvBnIDj.jpg
10493,Dead Calm,"An Australian couple take a sailing trip in the Pacific to forget about a terrible accident. While on the open sea, in dead calm weather conditions, they come across a ship with one survivor who is not at all what he seems.",Thriller,4/7/1989,,/jJj7moXpWkZm3pUgvQqriKHGfmQ.jpg,/kSC0I6EZXGH6Vm7skkvdQ5Nfsuk.jpg
10494,パーフェクトブルー,A retired pop singer turned actress' sense of reality is shaken when she is stalked by an obsessed fan and seemingly a ghost of her past.,Animation,7/25/1997,,/1YRtgjLb5xxUb2rsNRnr54Oc0B2.jpg,/79vujbsWEbX4dzffBV541QXN6sf.jpg
10495,The Karate Kid Part III,"Despondent over the closing of his karate school, Cobra Kai teacher John Kreese joins a ruthless businessman and martial artist to get revenge on Daniel and Mr. Miyagi.",Action,6/29/1989,The Karate Kid Collection,/c6VzS9jvifHrUajSP4RYiGINydo.jpg,/5qVjJGzPokkK7OYA65hYb1fGsJQ.jpg
10496,Bats,Genetically mutated bats escape and it's up to a bat expert and the local sheriff to stop them.,Horror,10/22/1999,Bats Collection,/hchZiGTq5fUBYzqhsIGvarLsVCf.jpg,/pZRcf2BwcxWg594X6XT2jkR2qdb.jpg
